product_id,product_title,rating,summary,review
ACCFR3Q77R6RRGAC,OnePlus Bullets Wireless Z Bluetooth Headset,5,Super!,"Great product Very much useful for us. It has all the best... Like sound quality, battery back up, buid quality, fitting in the 👂.. I recommend it for buy everyperson who's like wireless headphones..."
ACCFR3Q77R6RRGAC,OnePlus Bullets Wireless Z Bluetooth Headset,5,Perfect product!,I sanitize this oneplus bullets wireless fully satisfied for this product very nice build quality and sound quality very very good battery backup at this price. I have using this headphone for my oneplus 7 Pro device its perfect pair lots of love for oneplus .. thanks Flipkart for delivery on this critical condition all over world
ACCFR3Q77R6RRGAC,OnePlus Bullets Wireless Z Bluetooth Headset,4,Good quality product,Great product for the price compared to the other available in the market.Sound quality is good not great.The ear plugs magnets could have been more powerful.There should have been a flap sealing lid on the charging port.Fully satisfied with the battery backup.Go for it👍
ACCFR3Q77R6RRGAC,OnePlus Bullets Wireless Z Bluetooth Headset,5,Simply awesome,The BEST under 2k. The magnetic control is awesome. Neck band is really comfortable. The bass is not that good. But the overall sound is very very balanced and enriched. I had an awesome experience with it. The battery life is great. Easily gave me 20 hours of backup. This is an overall value for money product. Go for it.
ACCFR3Q77R6RRGAC,OnePlus Bullets Wireless Z Bluetooth Headset,5,Excellent,Every thing is great but battery backup is super great i liked it
ACCFR3Q77R6RRGAC,OnePlus Bullets Wireless Z Bluetooth Headset,5,Worth every penny,"Sound clarity is perfect,design built quality also good,most important thing is battery backup it superbb👌👌🔥🔥but bass is not that much good overall product is awesome 🔥🔥🔥😍😍"
ACCFR3Q77R6RRGAC,OnePlus Bullets Wireless Z Bluetooth Headset,5,Best in the market!,"Superb quality 👌 bass abd sound quality are also very fine... From my personal review, I like it low latency. Best for pubg and other games."
ACCFR3Q77R6RRGAC,OnePlus Bullets Wireless Z Bluetooth Headset,5,Mind-blowing purchase,"I dont know why some people are complaining about low bass , on the contrary they have quite adequate bass and when you pair them with devices having dolby audio , it just works like a charm.-Best build quality-Battery backup is one of the best in its segments -Sound quality is actually more than awesomeAnd its more than just value for money , in 2k their's no other good alternative .Got them at only at 1850 /-"
ACCFR3Q77R6RRGAC,OnePlus Bullets Wireless Z Bluetooth Headset,5,Super!,Z is not for bassheads but for those who want crystal clear sound and no muddiness at all.Mid-tones: 10/10High-tones: 10/10Bass: 7/10 Perfect switching between devices and 20 hours battery backup.And breakneck fast charging Speed Bass is there but not thumpy bass so songs like BELIEVER  may not sound good.But watching movies and stuff on this one is so terrific and enjoyable so 10/10 for that.For bass lovers oppo enco m31 would be a better choice cause it has 2 modes balanced mode and...
ACCFR3Q77R6RRGAC,OnePlus Bullets Wireless Z Bluetooth Headset,4,Worth the money,One of the finest headset in this prize range .And battery life is one of the greatest thing makes this product worty to buy .and talking about sound quality So one plus the name is enough 👍
ACCFR3Q77R6RRGAC,OnePlus Bullets Wireless Z Bluetooth Headset,5,Highly recommended,"This is a wonderful product Unless you have received a faulty unit. Let me help you here Pros -Best in class buildBest in class features (quick pairing and switching, super quick charge)Best in class battery lifeMost comfortable earphone (i have tried nearly all good earphones under 3000 both wired and wireless. Comfort of these are superb)Cons -Sound is like a typical 1000rs earphone.Bass is there but not that much.But still i am rating it 5* why because my friend No OTHER wirele..."
ACCFR3Q77R6RRGAC,OnePlus Bullets Wireless Z Bluetooth Headset,5,Just wow!,"This product is fabulous in this price range ..... In 2k I have 18hours playback. Earlier I thought that this product should give atleast 12 hours backup, but on other hand terrific battery life. If you are searching for wireless earphone then go for it. Just not because I'm saying, it just worth it."
ACCFR3Q77R6RRGAC,OnePlus Bullets Wireless Z Bluetooth Headset,5,Worth every penny,1)Sound Quality Is Best.2)Bass superb but less than OnePlus bullet 2.3) Design and Build quality is best.4) Battery Back-up is very very Awesome. Standby time is 8-9 hour in 10 min charging..5) Full charge backup 19-20 hours really good and Best..6) Latency is Awesome i am tested this in Call of Duty..7) Noise cancellation is in Average mode ..8) Full charge in 25-30 min..In 10 min 50-60 % charge.9) connectivity is Awesome working in OnePlus...Other devices take time 5-10 se...
ACCFR3Q77R6RRGAC,OnePlus Bullets Wireless Z Bluetooth Headset,5,Terrific purchase,"Really good wireless headset. I came across a lot of reviews saying the bass is not so good. But I didn't feel so . It's really good.The sound quality is so balanced and it's perfect for movies , music and calls."
ACCFKYE2ARGG67WC,realme Buds 2 Wired Headset,5,Highly recommended,Nice head set good fit nice quality good to handily poli aytem anu magnet pora kolllam migacha aytem
ACCFKYE2ARGG67WC,realme Buds 2 Wired Headset,5,Terrific purchase,The build quality is really good and the design also looks great. The magnets of earbuds are also really useful. The best part is the cable organizer which is really useful. The bass is good and the sound quality is also good you will not be disappointed buying this product at this price. The call quality is also good and the placement of buttons is very functional and useful. Buy without any doubt.
ACCFKYE2ARGG67WC,realme Buds 2 Wired Headset,5,Classy product,"outstanding product  best sound, good Bass, clear sound"" good job ""REALME ...👌👌👌"
ACCFKYE2ARGG67WC,realme Buds 2 Wired Headset,5,Terrific,"woww fantastic experience 😍 👍 and mainly discuss about this earphones is built quality is awesome 👌👍im fully satisfied with this earphones 👌👌👍   prons 1. built quality is awesome2. sound quality is just super 3. bass , treble,mid ranges are just good4. long and comfortable cable cons 1. missed L shape jackfinally my overall rating is 9.6 /10"
ACCFKYE2ARGG67WC,realme Buds 2 Wired Headset,5,Terrific,Unbelievable bass And very clear audio ear protection very strong I really prefer to purchase this fantastic realme buds thank you very much realme
ACCFKYE2ARGG67WC,realme Buds 2 Wired Headset,5,Excellent,nice earphones with smooth sound. even the build quality is best . this earphone is better for bass lover . and also  for smooth playback
ACCFKYE2ARGG67WC,realme Buds 2 Wired Headset,5,Simply awesome,What a immersive experience on the headphones...when i listen music on them it feels like i'm sitting in any live show... best sound quality i've ever experienced on this price range.  superb realme it wroth the price.. Its looks are also cool to see with yellow lines. The button of the remote are tactile and easy to use and differentiate. The sound goes to extreme volume no trouble after long hours of use.
ACCFKYE2ARGG67WC,realme Buds 2 Wired Headset,5,Brilliant,"It's a interesting product so I'm writing this after 24 hours of burn out.. so stay tuned to know the full story.. eartips are silicone tips very comfortable but doesn't stay in my ear much well, but your mileage may vary.. build is great but after receiving my item I noticed scuffs and nylons coming off a little from the part near 3.5 mm port.. otherwise it's built really well.. speakers for calls is tremendous easily putting mi basics to shame.. it's great for people like me who talks a lot..."
ACCFKYE2ARGG67WC,realme Buds 2 Wired Headset,5,Simply awesome,"Best in the market 😍😍😍. Enjoying its feel the real bass 😌😌. Good qualities of wire, comfortable to wear, and great sound quality 🥰🥰 . Value for money 🤑🤑."
ACCFKYE2ARGG67WC,realme Buds 2 Wired Headset,5,Brilliant,"Nice product , nice quality , great buss, I love it"
ACCFKYE2ARGG67WC,realme Buds 2 Wired Headset,2,Bad quality,"seriously abnormal bass guys...which is a big. negative about this earpiece ... ..i dont know why nobody paid attention to this bass boost feature , which is  annoying. ...you will never be able to listen to the originally recorded song ....but  will  hear  abnormal extreme bass in every song you play ..which may not be pleasing ....and you want to turn off the feature ...but you can not  coz it is a default  feature in this earpiece...sound clarity is good ..build also good .......but i wil..."
ACCFKYE2ARGG67WC,realme Buds 2 Wired Headset,3,Fair,"Bass is awesome, a little extra, so people who like bass will love this, I personally like a balanced sound signature, so bass can be turned down just a notch, but treble is waaaayyy too high. It really ruins the experience, it hurts my ears. Mids are pretty good. Build quality is decent. Too much treble ruins the sound quality, that's why 3 stars. If treble was balanced then would have given it 4 or even 5 maybe."
ACCFKYE2ARGG67WC,realme Buds 2 Wired Headset,5,Brilliant,"Realme rma155 vs boat 225 vs senhieser 180I have used all of them for 2 year boat , 6month senhiser , currently using realme since 2 week.Sound qualityRealme 9/10Boat 8/10Senhieser 10/10Volume Realme  10/10(11.2 mm drivers)BOat 9/10Senhieser 7/10BassRealme 9/10BoAt 10/10Senhiser 7/10Build quality Realme 9/10Boat 10/10Senhieser 5/10If you are only bass lover and don't care about lyrics then go for boat If you are only true music lover each and every notes matters for y..."
ACCFKYE2ARGG67WC,realme Buds 2 Wired Headset,5,Great product,"Sound quality is really good... Better than boat bass 200,225.. i have used many earphones like JBL , Skullcandy,boat,bout,leaf,bose,sony etc.. but i fell this is also good as leaf bolt ...  I love it😍.."
ACCFKYE2ARGG67WC,realme Buds 2 Wired Headset,1,Unsatisfactory,sound is good i mean it have very loud sound. but speaking about bass im not too happy with it because bass is soo powerful but not soo clear as jbl have
ACCFKYE2ARGG67WC,realme Buds 2 Wired Headset,5,Classy product,"It's a allrounder. I used this for playing pubg , footsteps is clearly audible, music is awesome . I suggest you to purchase this earphone if your budget is under 600. I am happy with the product."
ACCFKYE2ARGG67WC,realme Buds 2 Wired Headset,5,Awesome,Using since May 6th. And it is exceptional. Especially for pubg it's wonderful you can hear the footsteps form where they are coming. There were no problem listing music for long hours. Active noise cancellation is superb you did not hear anything around you when you plug and play. I previously used Mi basic after 1 year one side went not working. This one has better bass and sound clarity than Mi basic headset. Go for it guys
ACCFKYE2ARGG67WC,realme Buds 2 Wired Headset,5,Mind-blowing purchase,"sound quality+bass is quiet good , tangled free , and the design is great too , i give it a full 5 stars★★★★★"
ACCFKYE2ARGG67WC,realme Buds 2 Wired Headset,5,Mind-blowing purchase,It's a great product according to the price and its sound quality and bass is perfect.Realme Buds 2 really its a great headphone.In this price range best headphone ever.❤️
ACCFKYE2ARGG67WC,realme Buds 2 Wired Headset,1,Worthless,"After using 3 months, having mike issues. When you are playing songs it's good but when you are on call it's not a worthy enough"
ACCFKYE2ARGG67WC,realme Buds 2 Wired Headset,5,Awesome,"The Real Buds 2 (Feel The Real Bass)Design & Fit 5 - ⭐⭐⭐⭐⭐Sound Clarity & Bass 5 - ⭐⭐⭐ ⭐⭐Value For Money  5 - ⭐⭐⭐⭐⭐I Am Using For My OnePlus 6T ,I Got Best Budget Earphone From Realme 🙏🙏& Thanks To Flipkart Team For Within 2day FastDelivery ...Just Add To Cart & Buy This , Don't Wait........."
ACCFKYE2ARGG67WC,realme Buds 2 Wired Headset,4,Wonderful,Sound very good Punchy bassClear soundBut look is not so good especially in green color it’s looks so simple I mean quality Overall great purchase
ACCFKYE2ARGG67WC,realme Buds 2 Wired Headset,5,Mind-blowing purchase,"absolutely great product sound quality bass is great I did not expect that ,built quality is also great go & purchase guys but some cons are also there connector is not L shape treble will be improved in next version over all osm product bass lovers go for this earphones"
ACCFKYE2ARGG67WC,realme Buds 2 Wired Headset,5,Brilliant,Best product to buy 🌟🌟🌟🌟🌟It is good in realme Narzo 10A good base and high quality worth in price 🥰🥰
ACCFKYE2ARGG67WC,realme Buds 2 Wired Headset,4,Good quality product,every thing is great in this earphone just lacks clarity a bit and i guess its because of bass. cable: braidedlooks cool with black yellow combinationi like the magnetic earbuds
ACCFKYE2ARGG67WC,realme Buds 2 Wired Headset,5,Worth every penny,"Comparison Between Boat 225 , Realme Buds 2, Sennheiser CX 180Bass:-#1 Realme Buds 2 (Excellent Extra Bass)#2 Boat 225 ( It has also a good extra bass but not good as Realme Buds 2)#3 Sennheiser CX 180( it has no extra bass but the bass is just perfect when it required u feels a great bass)Build:-#1 Boat 225 ( boat is clearly winner on its build quality it feels more premiums than other two with its metal build and tangle free wire)#2 Realme Buds 2 ( It has also have a great build..."
ACCFKYE2ARGG67WC,realme Buds 2 Wired Headset,5,Awesome,"Writing review after 6 months of daily use..Personally i use earphones on daily basis. When i upgraded to these earphones, their design and build quality impressed me. In the first month it became too wet due to rain but still these works the same way as they were on first day.Good product."
ACCFKYE2ARGG67WC,realme Buds 2 Wired Headset,4,Pretty good,The best value for money product and also the  build quality is good and lite wait and I also like that yellow strip it's very useful
ACCFKYE2ARGG67WC,realme Buds 2 Wired Headset,5,Great product,"I don't know much about the technicality of the earphones but the sound output from these earphones  is pretty good for its price , sound coming from them is crystal clear ,these are undoubtedly the best earphones in this price range."
ACCFKYE2ARGG67WC,realme Buds 2 Wired Headset,5,Super!,bass Is awesome And  Clarity Is also Descent Bulit Quality Is really good Very Durable Cable Quality really Liked The Products Let's See How Long does It Last for?
ACCFKYE2ARGG67WC,realme Buds 2 Wired Headset,5,Worth every penny,"I literally love this product this sound quality is good i use more earphones like boat ,jbl,ubon etc but this earbuds are best I literally love this mic quality for recording."
ACCFKYE2ARGG67WC,realme Buds 2 Wired Headset,4,Good quality product,"Real me Buds 2 is awesome product, Great sound quality but bass is not up-to the mark. Awesome build quality. Value for money 👌👌👌"
ACCFKYE2ARGG67WC,realme Buds 2 Wired Headset,5,Simply awesome,Pros: 1.Sound is crisp and Clear 2.Bass is Awsome 3.Design and build quality excellent4.Cable organizer is usefull to carry pick up your earphone safetly5.Call quality is clearly delivered to whos speak with uscons:1. its a straight cable not triangle2.Not Gold plated 3.5mm Jack
ACCFKYE2ARGG67WC,realme Buds 2 Wired Headset,5,Classy product,Ordered 2 for my sis and my self. Good built quality. Bass Triple are well balanced. Producing wow sound effects with Power amp music player app. Comfortable fit. thanks for extra ear bud. Well and premium packing. On time delivery. Another gadget in my laptop.
ACCFKYE2ARGG67WC,realme Buds 2 Wired Headset,5,Best in the market!,I am happy good quality  product. Nice bass and sound clarity
ACCFKYE2ARGG67WC,realme Buds 2 Wired Headset,5,Excellent,Realme Buds2 is really gud product with comfort and quality. Satisfied with it. But only issue is small ear plugs are only one pair available in the box which are perfect fit in the ear where extra other plugs are big and not useful.
ACCFKYE2ARGG67WC,realme Buds 2 Wired Headset,5,Terrific purchase,It is the best in ear earphone in its price.nice built and noise isolation is good. You can feel every beats of bass.HD crystal clear sound. But the voice clarity could had been improved with the dual drivers. But still the best earphone in this budget. The build quality is also good and it doesn't feel cheap budget earphone.One more thing.... The cable organizer helps a lot while keeping the earphone safe and organized while travelling and keeping in jeans pocket.Hope realme buds 3 will co...
ACCFKYE2ARGG67WC,realme Buds 2 Wired Headset,3,Nice,Boat basshead 220 have better bass than buds2. But vocal of buds2 is better than boat 220...  It produces very clear sound 🔊 loved 😍 by music lover... Must buy but warranty must 1 year 😔
ACCFKYE2ARGG67WC,realme Buds 2 Wired Headset,5,Worth every penny,"I bought its because of their build quality, the sound quality is moderate. But they produce too much bass and lite and comfortable as you wear nothing. They are lite and well fitted in my ears with default buds.To conclude this might be the best pair of earphones you can get under Rs. 600. If your priorities are that the wire lasts long as it's don't get twitch easily. Don't think too much, just buy it. You will not regret it.v."
ACCFKYE2ARGG67WC,realme Buds 2 Wired Headset,5,Worth every penny,Sound quality is amazing and build quantity is also amazing my brother is also using this ear buds 1 for long time and its performance is still very good so I also ordered ear buds 2 and both are amazing and working up to expectations.
ACCFKYE2ARGG67WC,realme Buds 2 Wired Headset,5,Classy product,The Sound quality is superb and the base quality is also good ..The point thing which I liked in this earphone is that its durability ..the wire quality is good ..before I was using the sennheiser cx275 ..the wire got cut from middle ..I am happy with this earphones.
ACCFKYE2ARGG67WC,realme Buds 2 Wired Headset,5,Simply awesome,NICE PRODUCT... WORTH BUYING.....!!!!Its a Signature sound by Realme India..I love the sound... Best in Segment.@REALME INDIA.
ACCFKYE2ARGG67WC,realme Buds 2 Wired Headset,5,Mind-blowing purchase,"First of the design is so nice, the texture of the colour is amazing.. Now came to sound quality..I didn't expect it will be this good!! The bass is perfect for ears .. I really feel enjoyed whenever i listen any songs through this headset.. really satisfied for this product... recommend everyone to buy it and enjoy..Thank you."
ACCFKYE2ARGG67WC,realme Buds 2 Wired Headset,5,Best in the market!,"I am using this headphones from last 6 month , sound quality superb , bass is less in comparison of my brother's boat basshead 225 , but bass is good , built quality very good , magnit is a pros , valuable price , wire quality osm , and this is one of the  best headphones that I uses . 2nd is boat 225 ☺️☺️ must buy"
ACCFKYE2ARGG67WC,realme Buds 2 Wired Headset,4,Delightful,Good bass over all nice i get Rs599 MRP price is 699 if you are getting under 500 then best
ACCFKYE2ARGG67WC,realme Buds 2 Wired Headset,5,Best in the market!,"This is the best for daily use. It feels like nothing when in the ear and it's easy to keep organised, thanks to the magnets and organizer. It also has two extra buds one small and large which you can use according to your preference. It also has a tangle free wire. And Flipkart packing and delivery is always the best. No doubt about that."
ACCFKYE2ARGG67WC,realme Buds 2 Wired Headset,4,Good quality product,Sound quality is acceptable with price range.bass quality is super . Design and build quality is good but personally i Don't like tha wair .all thing is good is this price segment but i have some issue with this mic and the bottoms .
ACCFKYE2ARGG67WC,realme Buds 2 Wired Headset,3,Nice,"The sound and bass are really good. Bass is really powerful. After 2 weeks of use the pin end is somewhat broken from the inside. Seems wont last for more than 1-2 months at most. But all the other parts looks better built. I have very rough use and i keep my headset in a pouch. Not worth 600, flipkart smartbuy headphones are better but not much rich in sound like this one."
ACCFKYE2ARGG67WC,realme Buds 2 Wired Headset,5,Brilliant,Best earphone under this price range i have bought sony buds which was available Rs100 more than this price but its sound was low in compare to realme buds2 best earphone under this price range with boosted bass bass is best
ACCFKYE2ARGG67WC,realme Buds 2 Wired Headset,5,Just wow!,"It's sound is osum and bass too , earphone material also very good and trust me guys I am writing this review after 7 month and it is perfect for you so buy this earphone"
ACCFVA3KZ2EYMYX3,OnePlus Bullets Wireless Z Bass Edition Bluetooth Headset,5,Highly recommended,Good battery 🔋 👌 Sound awesome 👌 Bass 🔊  super Overall good 👍  product in one plus
ACCFVA3KZ2EYMYX3,OnePlus Bullets Wireless Z Bass Edition Bluetooth Headset,5,Super!,Very nice product with amazing battery back up and deep bass.. Awsome sound clarity.it is very flexible  Length of wire is little low.
ACCFVA3KZ2EYMYX3,OnePlus Bullets Wireless Z Bass Edition Bluetooth Headset,4,Really Nice,This review i was posted after 1 week using this 1+ bass editions neckband. It's sound quality is awesome bass effect also awesom then call audio quality also super when i receive this project it was 100% changed i was used more then 4 days in this neckband using audio and video player per day i am used 3 hrs approximately after 4 days i god 40% of remaining charger. i changed this  neckband with in 10 minutes its fully charged. its worth for money.
ACCFVA3KZ2EYMYX3,OnePlus Bullets Wireless Z Bass Edition Bluetooth Headset,5,Brilliant,"I've been using this product for the last 3 days. This might be too early to write an elaborate review but I've known enough about this neckband to be ""eligible"".1. Sound Quality: The drivers definitely produce a very balanced sound that is surely going to satisfy most of the people including me. Whether it's about mid frequencies, vocals or the high frequency trebles, or even the lower frequencies, this neckband deals all of those with superior performance. Undoubtedly.2. Bass: Bass is..."
ACCFVA3KZ2EYMYX3,OnePlus Bullets Wireless Z Bass Edition Bluetooth Headset,5,Awesome,"Excellent quality.. Packing is awesome.. Neckband quality is impressive its very Soft rubber, light weight.. Sound quality is very nice.. And bass is impressive.. Backup is approx 14 to 15 hours easily  in medium volume.. Very fast Bluetooth connectivity and switching.. Type c charging cable.. I think it is best in this Price range."
ACCFVA3KZ2EYMYX3,OnePlus Bullets Wireless Z Bass Edition Bluetooth Headset,5,Must buy!,This review i was posted after 1 week using this 1+ bass editions neckband. It's sound quality is awesome bass effect also awesome then call audio quality also super when i receive this project it was 100% changed i was used more then 4 days in this neckband using audio and video player per day i am used 3 hrs approximately after 4 days i got 40% of remaining charger. i changed this neckband with in 10 minutes its fully charged. its worth for money.
ACCFVA3KZ2EYMYX3,OnePlus Bullets Wireless Z Bass Edition Bluetooth Headset,5,Best in the market!,Quality is very goodAndSound and bass is also very good But battery is not good Battery backup is not 17hours Battery backup only 10 hours on full volumeAnd this earphone is very good on all condition But battery is not on markAnd 10 to 12 it charge 70 to 80 and playback time upto 8 hoursAnd it completely charge in 20 to 30 minutes But no warning for low batteryI check two time i can not seen low battery warningOverall great product in this price
ACCFVA3KZ2EYMYX3,OnePlus Bullets Wireless Z Bass Edition Bluetooth Headset,4,Value-for-money,"1. Call quality is Good. I have tested the call infront of high volume TV. The call was pretty good and didn't hear much noise if TV music. 4.5/52. Music is good. Bass is not as expected. But if you adjust the Equalizer, the Music is good. 4/5.3. Comfort is Pretty good. 5/5.4. Battery is also really good. 5/5."
ACCFVA3KZ2EYMYX3,OnePlus Bullets Wireless Z Bass Edition Bluetooth Headset,1,Terrible product,If you are bass lover don't dare to buy this. Bass is really very bad. I have used Sony earphones and they offer pretty good bass than it. I bought this due to hype but in actuality it's not even close to my expectations. Whenever i listen to music it makes me  🤬
ACCFVA3KZ2EYMYX3,OnePlus Bullets Wireless Z Bass Edition Bluetooth Headset,5,Fabulous!,It was a fantastic experience using this earpiece its just awesome and i loved it like anything it has all the features qnd a definitely good base with good sound quality..i was bit unhappy with its clarity else i was really impressed by its working
ACCFVA3KZ2EYMYX3,OnePlus Bullets Wireless Z Bass Edition Bluetooth Headset,4,Good choice,"The sound quality is really good and it's worth every penny. But the unit I received had some manufacturing defect so after around 3 months of use, the volume in the left side kept decreasing for a week and then completely stopped. Thanks to the one year warranty I took it to the service centre for replacement. And they said I'll get the new one in 7 to 10 days! That's a long time for a music lover to stay without earphones... I also checked the OnePlus website and there were a lot of people ..."
ACCFVA3KZ2EYMYX3,OnePlus Bullets Wireless Z Bass Edition Bluetooth Headset,5,Wonderful,The quality of the headphone is awesome. Easy to connect to any mobile and PC. Sound quality and bass are satisfactory and worth every penny. Go for it!
